{
  "$schema": "../../schemas/sprocket-mod.schema.json",
  "schema_version": 3,
  "id": "furryaxw.cannon-sound-pool-fix",
  "name": "CannonSoundPoolFix",
  "authors": ["furryAxw"],
  "repository": "furryaxw/CannonSoundPoolFix",
  "license": "GPL-3.0-only",
  "display_name": {
    "en": "Cannon Sound Pool Fix",
    "zh": "火炮声音池修复"
  },
  "description": {
    "en": "Prevents rapid-fire cannons from exhausting Sprocket's audio pool while preserving muzzle effects.",
    "zh": "防止高射速火炮耗尽 Sprocket 音频池，同时保留炮口特效。"
  },
  "release": {
    "include_prerelease": false,
    "version_pattern": "^v?([0-9]+\\.[0-9]+\\.[0-9]+(?:-[0-9A-Za-z.-]+)?)$",
    "assets": {
      "include": ["CannonSoundPoolFix.dll"],
      "exclude": []
    }
  },
  "dependencies": [],
  "recommendations": [],
  "featured": true,
  "install": {
    "files": [
      {
        "match": "*.dll",
        "type": "melonloader:*"
      }
    ],
    "scan_dlls": true,
    "exclude": []
  },
  "category": "audio",
  "tags": ["audio", "cannon", "performance", "sound-pool"]
}
