{
  "$schema": "../../schemas/sprocket-mod.schema.json",
  "schema_version": 3,
  "id": "example.sprocket-mod",
  "name": "ExampleSprocketMod",
  "authors": [
    "ExampleAuthor"
  ],
  "repository": "ExampleAuthor/ExampleSprocketMod",
  "license": "MIT",
  "display_name": {
    "en": "Example Sprocket Mod"
  },
  "release": {
    "include_prerelease": false,
    "version_pattern": "^v?([0-9]+\\.[0-9]+\\.[0-9]+(?:-[0-9A-Za-z.-]+)?)$",
    "assets": {
      "include": [
        "*.dll",
        "*.zip"
      ],
      "exclude": [
        "*debug*",
        "*symbols*",
        "*source*"
      ]
    }
  },
  "dependencies": [],
  "companions": [],
  "recommendations": [],
  "featured": false,
  "install": {
    "files": [
      {
        "match": "*.dll",
        "type": "melonloader:mod"
      }
    ],
    "scan_dlls": true,
    "exclude": []
  },
  "category": "gameplay",
  "tags": [
    "example"
  ]
}
